[
  {
    "id": "afterfly",
    "listingVariant": "unclaimedScraped",
    "dataOrigin": "organizerIntake",
    "name": "AFTER FLY",
    "slug": "afterfly",
    "city": "Indore",
    "citySlug": "indore",
    "region": "Madhya Pradesh",
    "country": "India",
    "path": "/organizers/afterfly/",
    "legacyPaths": [
      "/organizers/indore/afterfly-run-club/"
    ],
    "category": "Progressive techno run club",
    "status": "unclaimed",
    "indexing": "index, follow",
    "sourceConfidence": "high",
    "headline": "AFTER FLY run club in Indore",
    "description": "AFTER FLY is an Indore run-and-rave organizer discovered through a public Luma event page. This unclaimed profile summarizes verified public facts for owner review and stays out of search until cadence, contact, and claim details are confirmed.",
    "sourceSummary": "A public Luma event page confirms AFTER FLY hosted AFTERFLY TAKEOFF RUN & RAVE in Indore on 2025-03-16. The page describes a movement-and-music community and the embedded event data lists Instagram handle afterfly.in.",
    "logo": {
      "mode": "monogram",
      "text": "AF",
      "status": "not_verified"
    },
    "formats": [
      "Social runs",
      "Run-and-rave",
      "Fitness/wellness community",
      "Techno afters"
    ],
    "facts": [
      {
        "label": "Location",
        "value": "Indore, Madhya Pradesh"
      },
      {
        "label": "Official source name",
        "value": "AFTER FLY"
      },
      {
        "label": "Instagram",
        "value": "afterfly.in"
      },
      {
        "label": "Format",
        "value": "Run club plus post-run music social"
      },
      {
        "label": "Verified event",
        "value": "AFTERFLY TAKEOFF RUN & RAVE, 16 Mar 2025"
      },
      {
        "label": "Categories",
        "value": "Fitness, Wellness"
      },
      {
        "label": "Claim state",
        "value": "Unclaimed seed listing"
      },
      {
        "label": "Indexing",
        "value": "Noindex until verified"
      }
    ],
    "eventEvidence": [
      {
        "date": "16 Mar 2025, 7:00 AM-11:00 AM IST",
        "facts": [
          "Hosted by AFTER FLY",
          "Listed under Fitness and Wellness",
          "Run segment described as 2.2 km and optional for walkers",
          "Page copy states INR 499 per person with payment link sent by Instagram DM after registering",
          "Luma registration is closed on the public page"
        ],
        "location": "Indore, Madhya Pradesh",
        "sourceHref": "https://luma.com/pxgmph3b",
        "sourceLabel": "Luma event page",
        "summary": "The public Luma page lists a Sunday social run from Traffic Park near Daly College followed by a post-run techno social at Tropico Cafe.",
        "title": "AFTERFLY TAKEOFF RUN & RAVE"
      }
    ],
    "reviews": [],
    "fitNotes": [
      "Repeatable run-club programming is a strong Catch organizer category because guests already share a live activity.",
      "Indore gives the first test outside the largest metros, which helps validate city coverage and source sparsity.",
      "Run-and-rave programming is a useful adjacency test because it blends low-pressure activity, curated crowd energy, and a post-event social setting."
    ],
    "missingEvidence": [
      "Owner verification or claim",
      "Logo or profile image permission",
      "Current event cadence after March 2025",
      "Owner or host contact outside platform relay",
      "Current booking or attendance process",
      "Whether the public Instagram handle is the preferred owner contact"
    ],
    "sources": [
      {
        "type": "user_supplied",
        "label": "User seed input",
        "detail": "User requested an initial listing for Afterfly Run Club in Indore.",
        "confidence": "medium"
      },
      {
        "type": "public_event_page",
        "label": "Luma event page",
        "detail": "AFTERFLY TAKEOFF RUN & RAVE is a public event page hosted by AFTER FLY in Indore, with Fitness and Wellness categories, registration closed, and source copy describing a run plus post-run techno social.",
        "confidence": "high",
        "href": "https://luma.com/pxgmph3b"
      },
      {
        "type": "embedded_event_data",
        "label": "Luma structured event data",
        "detail": "The event page's structured data confirms the Indore location and 2025-03-16 timing; embedded page data lists instagram_handle afterfly.in.",
        "confidence": "high",
        "href": "https://luma.com/pxgmph3b"
      }
    ],
    "claim": {
      "href": "/organizers/afterfly/#claim",
      "label": "Claim this listing"
    },
    "publicApi": {
      "state": "disabled",
      "reason": "Claiming is not available until target readiness is verified against Firestore.",
      "claimTargetSyncStatus": "unknown"
    },
    "authority": {
      "ownershipState": "programmatic",
      "claimState": "unclaimed",
      "provenanceOrigin": "import",
      "sourceConfidence": "high",
      "verificationStatus": "sourceBacked",
      "appVisibility": "hidden",
      "publishStatus": "published",
      "indexStatus": "indexed"
    },
    "capabilities": {
      "claimRequest": {
        "state": "disabled",
        "reason": "Claiming is not available until target readiness is verified against Firestore."
      },
      "publicReviews": {
        "targetState": "disabled",
        "readState": "disabled",
        "writeState": "disabled",
        "reason": "Public reviews are unavailable until canonical target readiness is verified."
      },
      "supply": {
        "mode": "unclaimed_read_only",
        "bookable": false,
        "paymentsEnabled": false,
        "waitlistEnabled": false,
        "hostContactEnabled": false,
        "claimable": true,
        "reviewPolicy": "after_event_end"
      }
    },
    "lastVerifiedAt": "2026-06-10",
    "searchText": "after fly indore indore club progressive techno run club progressive techno run club afterfly.in social runs run-and-rave fitness/wellness techno afters social runs run-and-rave fitness/wellness community techno afters"
  },
  {
    "id": "bhag",
    "listingVariant": "unclaimedScraped",
    "dataOrigin": "organizerIntake",
    "name": "Bhag Club",
    "slug": "bhag",
    "city": "New Delhi",
    "citySlug": "delhi",
    "region": "Delhi",
    "country": "India",
    "path": "/organizers/bhag/",
    "legacyPaths": [
      "/organizers/delhi/bhag-run-club/"
    ],
    "category": "Running community and activewear brand",
    "status": "unclaimed",
    "indexing": "noindex, follow",
    "sourceConfidence": "medium",
    "headline": "Bhag Club running community in Delhi",
    "description": "Bhag Club appears to be both a running community and an activewear brand. Its official website describes weekly runs, training programs, and performance activewear; this Delhi-targeted Catch profile remains unclaimed and noindexed until a stable Delhi-specific source is verified.",
    "sourceSummary": "The official Bhag site confirms the brand/community positioning. A public Luma event page confirms a BHAG RUNS calendar and Bhag Club host profile with a Gurgaon event, but not a Delhi-specific event in this pass.",
    "logo": {
      "mode": "monogram",
      "text": "BC",
      "status": "not_verified"
    },
    "formats": [
      "Community runs",
      "Training programs",
      "Fitness events",
      "Activewear"
    ],
    "facts": [
      {
        "label": "Location target",
        "value": "Delhi, India"
      },
      {
        "label": "City evidence",
        "value": "Delhi is user-supplied; Gurgaon event evidence found"
      },
      {
        "label": "Official source name",
        "value": "Bhag Club"
      },
      {
        "label": "Luma calendar",
        "value": "BHAG RUNS"
      },
      {
        "label": "Instagram",
        "value": "bhagclub"
      },
      {
        "label": "Verified event",
        "value": "Bhag GGN, 8 Nov 2025"
      },
      {
        "label": "Claim state",
        "value": "Unclaimed seed listing"
      },
      {
        "label": "Indexing",
        "value": "Noindex until Delhi evidence is verified"
      }
    ],
    "eventEvidence": [
      {
        "date": "8 Nov 2025, 7:00 AM-9:00 AM IST",
        "facts": [
          "Hosted by Bhag Club under the BHAG RUNS calendar",
          "Listed under Fitness",
          "Event location is Gurugram, not Delhi",
          "Registration questions include Instagram, age, gender, emergency contact, attendance intent, and consent",
          "Embedded host data lists website thebhag.in and social handle bhagclub"
        ],
        "location": "Espressos AnyDay, Gurugram, Haryana",
        "sourceHref": "https://luma.com/ixj7uqiu",
        "sourceLabel": "Luma event page",
        "summary": "The public Luma page lists a Bhag Club-hosted Gurgaon run from Espressos AnyDay with a 3KM distance and free general admission.",
        "title": "Bhag GGN"
      }
    ],
    "reviews": [],
    "fitNotes": [
      "BHAG shows why the entity model needs to cover brands and organizers, not only clubs.",
      "The Luma event includes registration questions, consent, emergency contact, and attendance intent, which maps to Catch's host onboarding and event policy surfaces.",
      "The official website combines commerce and community; organizer profiles need to model external websites and source-backed event evidence separately from Catch events."
    ],
    "missingEvidence": [
      "Stable Delhi-specific event evidence",
      "Owner verification or claim",
      "Logo or profile image permission",
      "Current Delhi cadence",
      "Preferred business contact for the organizer",
      "Whether Bhag Club should be represented as one national brand or separate city chapters"
    ],
    "sources": [
      {
        "type": "user_supplied",
        "label": "User seed input",